{
    "$schema": "https://raw.githubusercontent.com/sivrad/matrix-schema/main/type.json",
    "name": "Person",
    "label": "Person",
    "description": "A person is a being that has certain capacities or attributes such as reason, morality, consciousness or self-consciousness, and being a part of a culturally established form of social relations such as kinship, ownership of property, or legal responsibility.",
    "icon": "https://upload.wikimedia.org/wikipedia/commons/thumb/d/d8/Person_icon_BLACK-01.svg/1200px-Person_icon_BLACK-01.svg.png",
    "parent": "Organism",
    "fields": {
        "surname": {
            "label": "Surname",
            "type": "string | null",
            "description": "The surname of the person.",
            "defaultValue": null
        },
        "middleName": {
            "label": "Middle Name",
            "type": "string | null",
            "description": "The middle name of the person.",
            "defaultValue": null
        },
        "givenName": {
            "label": "Given Name",
            "type": "string | null",
            "description": "The given name of the person.",
            "defaultValue": null
        }
    },
    "fieldValues": {
        "species": "human"
    }
}
