{
    "$schema": "../../schema.json",
    "name": "Duration",
    "label": "Duration",
    "description": "A duration of time.",
    "icon": "https://img.icons8.com/pastel-glyph/2x/clock--v2.png",
    "parent": "Scalar",
    "fields": {
        "seconds": {
            "label": "Seconds",
            "type": "number",
            "description": "The number of seconds."
        }
    }
}
